{
  "schema_version": "live-snapshot-v1",
  "ruleset": {
    "manifest_id": "sha256:cd469f5218ffab6d979f5eb43233e90fbe3d81919f6c21169b57a95cbe69a6bd",
    "patch_id": "sts2-v0.107.1-59260271",
    "admission_status": "pending_conformance",
    "engine": {
      "component_id": "megacrit-sts2-installed-game",
      "version": "v0.107.1",
      "revision": "59260271",
      "source": "steam://app/2868840",
      "digest": {
        "algorithm": "sha256",
        "value": "e7ceb80669bfaf5c8fccabaa126ae2bb283aba514be5b5b55612579cfd285f18"
      }
    },
    "adapter": {
      "component_id": "sts2mcp-live-bridge",
      "version": "0.4.0",
      "revision": "55e064850a68f3b4cde7e5fd525bf9b2dec4e885",
      "source": "https://github.com/Gennadiyev/STS2MCP",
      "digest": {
        "algorithm": "git-commit-sha1",
        "value": "55e064850a68f3b4cde7e5fd525bf9b2dec4e885"
      }
    },
    "mechanics": [
      {
        "artifact_id": "sts2-v0.107.1-macos-arm64-assembly",
        "kind": "authoritative-game-assembly",
        "version": "v0.107.1/59260271",
        "platform": "macos",
        "architecture": "arm64",
        "digest": {
          "algorithm": "sha256",
          "value": "e7ceb80669bfaf5c8fccabaa126ae2bb283aba514be5b5b55612579cfd285f18"
        },
        "size_bytes": 9363456
      }
    ],
    "interface": {
      "observation_schema": "observation-v1",
      "action_schema": "action-v1",
      "information_policy_id": "public-state-v1"
    }
  },
  "observation": {
    "schema_version": "observation-v1",
    "patch_id": "sts2-v0.107.1-59260271",
    "decision_type": "menu",
    "public_state": {
      "state_type": "menu",
      "menu_screen": "character_select",
      "message": "Select a character.",
      "characters": [
        {
          "id": "IRONCLAD",
          "name": "The Ironclad",
          "locked": false,
          "hp": 80,
          "gold": 99,
          "energy": 3
        }
      ],
      "options": [
        {
          "name": "IRONCLAD",
          "enabled": true
        },
        {
          "name": "REGENT",
          "enabled": false
        },
        {
          "name": "back",
          "enabled": true
        }
      ],
      "lobby": {
        "type": "singleplayer"
      },
      "terminal": false,
      "victory": false
    },
    "state_hash": "4cdf1e6f42f04bfd31de589dff96dcee5c3595a20b39a8654644e83f70ba58de"
  },
  "legal_actions": [
    {
      "action_id": "menu_select:ed10dff7281262e0",
      "kind": "menu_select",
      "payload": {
        "option": "IRONCLAD"
      }
    },
    {
      "action_id": "menu_select:82fb7135ef43783f",
      "kind": "menu_select",
      "payload": {
        "option": "back"
      }
    }
  ],
  "bridge": {
    "component_id": "sts2mcp",
    "version": "0.4.0",
    "protocol": "sts2mcp-http-v1",
    "read_only": true
  },
  "action_coverage": {
    "status": "ready",
    "issues": []
  },
  "projection": {
    "omitted_source_paths": [
      "source.lobby.seed"
    ]
  }
}
